{
  "schemaVersion": "2.0.0",
  "yearMonth": "2026-09",
  "week": {
    "isoYear": 2026,
    "isoWeek": 38,
    "id": "2026-W38",
    "start": "2026-09-14",
    "end": "2026-09-20"
  },
  "updatedAt": "2026-09-21T10:27:01+07:00",
  "days": [
    {
      "date": "2026-09-18",
      "report": {
        "schemaVersion": "1.0.0",
        "id": "daily-brief-2026-09-18",
        "type": "daily_market_brief",
        "locale": "vi-VN",
        "timezone": "Asia/Ho_Chi_Minh",
        "generatedAt": "2026-09-18T16:54:00+07:00",
        "coverage": {
          "from": "2026-09-17T16:00:00+07:00",
          "to": "2026-09-18T16:54:00+07:00",
          "session": "closed"
        },
        "marketSession": "closed",
        "disclaimer": "Nguồn công khai. Không phải khuyến nghị đầu tư. Một số chuỗi 1Y được nội suy. Số tự doanh và cá nhân chưa tách được thì để trống.",
        "ui": {
          "pageSizeNews": 8,
          "defaultChartTab": "vnindex",
          "defaultWorldSymbol": "DJI"
        },
        "snapshot": {
          "quotes": [
            {
              "symbol": "VNINDEX",
              "nameVi": "VN-Index",
              "assetClass": "equity_index",
              "price": 1815.66,
              "change": -7.11,
              "changePct": -0.39,
              "session": "close",
              "sourceId": "src-yahoo-vn"
            },
            {
              "symbol": "HNX",
              "nameVi": "HNX",
              "assetClass": "equity_index",
              "price": 275.29,
              "change": 1.39,
              "changePct": 0.51,
              "session": "close",
              "sourceId": "src-stockbiz"
            },
            {
              "symbol": "DXY",
              "nameVi": "DXY",
              "assetClass": "fx",
              "price": 100.36,
              "changePct": 0.11,
              "sourceId": "src-te"
            },
            {
              "symbol": "DJI",
              "nameVi": "Dow Jones",
              "assetClass": "equity_index",
              "price": 51778.04,
              "changePct": 0.61,
              "sourceId": "src-yahoo-vn"
            },
            {
              "symbol": "NDX",
              "nameVi": "Nasdaq",
              "assetClass": "equity_index",
              "price": 26418.3,
              "changePct": 1.69,
              "sourceId": "src-yahoo-vn"
            },
            {
              "symbol": "SPX",
              "nameVi": "S&P 500",
              "assetClass": "equity_index",
              "price": 7637.76,
              "changePct": 1.14,
              "sourceId": "src-yahoo-vn"
            },
            {
              "symbol": "NKY",
              "nameVi": "Nikkei",
              "assetClass": "equity_index",
              "price": 65018.95,
              "changePct": 1.38,
              "sourceId": "src-yahoo-vn"
            },
            {
              "symbol": "HSI",
              "nameVi": "Hang Seng",
              "assetClass": "equity_index",
              "price": 24750.78,
              "changePct": 0.6,
              "sourceId": "src-yahoo-vn"
            },
            {
              "symbol": "WTI",
              "nameVi": "WTI",
              "assetClass": "commodity",
              "price": 100.24,
              "changePct": -1.64,
              "sourceId": "src-te"
            },
            {
              "symbol": "XAU",
              "nameVi": "Vàng",
              "assetClass": "commodity",
              "price": 4393.62,
              "changePct": 1.2,
              "sourceId": "src-te"
            },
            {
              "symbol": "BTC",
              "nameVi": "Bitcoin",
              "assetClass": "crypto",
              "price": 77559.3,
              "changePct": 1.53,
              "sourceId": "src-yahoo-btc"
            },
            {
              "symbol": "USDVND",
              "nameVi": "USD/VND TT",
              "assetClass": "fx",
              "price": 25632,
              "changePct": null,
              "sourceId": "src-nhnn"
            }
          ]
        },
        "globalNews": [
          {
            "id": "g1",
            "date": "2026-09-18T06:00:00+07:00",
            "title": "Phố Wall hồi phục mạnh nhất 6 tuần sau Fed",
            "summary": "Dow +0,61% lên 51.778; S&P +1,14% lên 7.637,76; Nasdaq +1,69% lên 26.418. Công nghệ dẫn sóng sau khi dầu và lợi suất hạ.",
            "impact": {
              "direction": "risk_on",
              "horizon": "days",
              "assets": [
                "DJI",
                "SPX",
                "NDX",
                "VNINDEX"
              ],
              "text": "Risk-on hỗ trợ tâm lý phiên Á nhưng VN lệch nhịp vì ATC/ETF."
            },
            "image": {
              "url": "https://picsum.photos/seed/ws/800/400"
            },
            "sourceId": "src-reuters"
          },
          {
            "id": "g2",
            "date": "2026-09-18T08:00:00+07:00",
            "title": "Dầu WTI quanh 100 USD, Brent lùi dưới 105",
            "summary": "WTI ~100,2 USD (−1,64%). Brent quanh 102–105 USD khi lo ngại Hormuz dịu và Saudi khôi phục một phần đường ống.",
            "impact": {
              "direction": "mixed",
              "horizon": "weeks",
              "assets": [
                "WTI"
              ],
              "text": "Dầu hạ giảm áp lực CPI vận tải tại Việt Nam nhưng vẫn cao hơn đầu năm."
            },
            "image": {
              "url": "https://picsum.photos/seed/oil/800/400"
            },
            "sourceId": "src-te"
          },
          {
            "id": "g3",
            "date": "2026-09-18T07:00:00+07:00",
            "title": "SEC miễn trừ 5 năm cho giao dịch cổ phiếu mã hóa",
            "summary": "Tokenized stocks; Circle, Robinhood, Coinbase tăng hơn 5% phiên Wall Street.",
            "impact": {
              "direction": "risk_on",
              "horizon": "weeks",
              "assets": [
                "BTC",
                "ETH"
              ],
              "text": "Hỗ trợ crypto và fintech, chưa phải tín hiệu dòng vốn vào VN."
            },
            "image": {
              "url": "https://picsum.photos/seed/sec/800/400"
            },
            "sourceId": "src-reuters"
          },
          {
            "id": "g4",
            "date": "2026-09-18T09:00:00+07:00",
            "title": "BoJ tăng lãi cao nhất 31 năm, USDJPY quanh 157,8",
            "summary": "Yên yếu hơn vì lãi Nhật vẫn thấp so với trung tính; carry có thể sống lại.",
            "impact": {
              "direction": "mixed",
              "horizon": "days",
              "assets": [
                "NKY",
                "DXY"
              ],
              "text": "Yên biến động có thể rút carry nếu BoJ bất ngờ hawkish hơn."
            },
            "image": {
              "url": "https://picsum.photos/seed/boj/800/400"
            },
            "sourceId": "src-bloomberg"
          },
          {
            "id": "g5",
            "date": "2026-09-18T14:14:00+07:00",
            "title": "LHQ cáo buộc Mỹ trong chiến dịch Iran",
            "summary": "Báo cáo nêu tấn công không phân biệt; xung đột Trung Đông bước sang tháng thứ bảy.",
            "impact": {
              "direction": "risk_off",
              "horizon": "weeks",
              "assets": [
                "WTI",
                "XAU"
              ],
              "text": "Giữ premium địa chính trị trên vàng và dầu."
            },
            "image": {
              "url": "https://picsum.photos/seed/iran/800/400"
            },
            "sourceId": "src-cafef"
          },
          {
            "id": "g6",
            "date": "2026-09-18T09:16:00+07:00",
            "title": "Dimon: lạm phát chưa chắc đã hết, Fed có thể thắt chặt thêm",
            "summary": "Fed vừa tăng 25 điểm cơ bản lần đầu kể từ 2023, đưa fed funds lên 3,75–4,00%.",
            "impact": {
              "direction": "risk_off",
              "horizon": "weeks",
              "assets": [
                "DXY",
                "USDVND"
              ],
              "text": "Lãi USD cao kéo dài áp lực tỷ giá và định giá EM."
            },
            "image": {
              "url": "https://picsum.photos/seed/fed/800/400"
            },
            "sourceId": "src-cafef"
          },
          {
            "id": "g7",
            "date": "2026-09-18T07:30:00+07:00",
            "title": "Lợi suất Mỹ 10Y lùi dưới 5%, vàng giữ trên 4.350 USD",
            "summary": "10Y quanh 4,93–4,95%. Vàng giao ngay ~4.394 USD (+1,2% theo Trading Economics).",
            "impact": {
              "direction": "risk_on",
              "horizon": "intraday",
              "assets": [
                "SPX",
                "XAU"
              ],
              "text": "Lợi suất hạ hỗ trợ duration và vàng; vàng SJC trong nước cũng hồi."
            },
            "image": {
              "url": "https://picsum.photos/seed/bond/800/400"
            },
            "sourceId": "src-te"
          },
          {
            "id": "g8",
            "date": "2026-09-18T08:00:00+07:00",
            "title": "Nikkei +1,38%, Hang Seng +0,60%, Kospi dẫn Á",
            "summary": "Châu Á theo đà Wall Street và chip; HSI 24.750,78.",
            "impact": {
              "direction": "risk_on",
              "horizon": "intraday",
              "assets": [
                "NKY",
                "HSI"
              ],
              "text": "VN lệch nhịp vì ETF cơ cấu dù ngoại mua ròng."
            },
            "image": {
              "url": "https://picsum.photos/seed/asia/800/400"
            },
            "sourceId": "src-yahoo-vn"
          }
        ],
        "vietnamNews": [
          {
            "id": "v1",
            "date": "2026-09-18T16:18:00+07:00",
            "title": "VN-Index đảo chiều ATC, đóng 1.815,66 (−0,39%)",